,,10.0,,,,2009.0,,Diseño y aplicación de la política educativa,,,,Educación,Desarrollo Social,"Asesorías, Consultorías, Servicios Informáticos, Estudios e Investigaciones y Otros Servicios",Diseño y aplicación de la política educativa,Educación Pública,Otros Servicios Educativos y Actividades Inherentes,,"Dirección General de Acreditación, Incorporación y Revalidación",,"Planeación, seguimiento y evaluación de políticas públicas",,Recursos fiscales,Gasto corriente,,,,,,,,,1.0,0.0,,,2.0,P,,806382.0,,,3300.0,,,,1.0,,,,11,,,9.0,,,1.0,,,211,,,,,,,
,,1.0,,,,2009.0,,Función pública y buen gobierno,,,,Administración Pública,Gobierno,Servicios Básicos,Actividades de apoyo a la función pública y buen gobierno,Presidencia de la República,Función Pública,,Coordinación General de Administración,,Apoyo a la función pública y al mejoramiento de la gestión,,Recursos fiscales,Gasto corriente,,,,,,,,,1.0,8.0,,,1.0,O,,493742.0,,,3100.0,,,,1.0,,,,2,,,3.0,,,1.0,,,113,,,,,,,
,,,,,,,,,,,,,,,,,,,,,,,,,,,,,,,,,,,,,,,,,,,,,,,,,,,,,,,,,,,,,,,,,,,
,,8.0,,,,2014.0,,,,Desarrollo Económico,Recursos fiscales,Transporte,,Otros servicios generales,Definición y conducción de la política de comunicaciones y transportes,Comunicaciones y Transportes,Otros Relacionados con Transporte,Gasto corriente,Subsecretaría de Transporte,Regulación eficiente de las comunicaciones y los transportes,,"Planeación, seguimiento y evaluación de políticas públicas",,,,,,,,,,3.0,1.0,5.0,,,,,P,"40,000.00",,,3900.0,,,,1.0,,,,9,,,6.0,,,1.0,,,300,,,,,,,
,,7.0,,,,2011.0,,,,Gobierno,Recursos fiscales,"Orden, Seguridad y Justicia",,Servicios basicos,Promoción del respeto a los derechos humanos y atención a víctimas del delito,Procuraduría General de la República,Procuración de Justicia,Gasto corriente,Procuraduría General de la República,Representación jurídica de la Federación en el ámbito interno e internacional,,Prestación de Servicios Públicos,,,,,,,,,,1.0,1.0,6.0,,,,,E,6923193.0,,,3100.0,,,,9.0,,,,17,,,3.0,,,1.0,,,100,,,,,,,
,,2.0,,,,2014.0,,,,Desarrollo Social,Recursos fiscales,Educación,,"Materiales de administracion, emision de documentos y articulos oficiales",Actividades de apoyo administrativo,Educación Pública,Otros Servicios Educativos y Actividades Inherentes,Gasto corriente,Dirección General de Recursos Materiales y Servicios,Servicios de apoyo administrativo,,Apoyo al proceso presupuestario y para mejorar la eficiencia institucional,,,,,,,,,,2.0,1.0,5.0,,,,,M,"545,686.00",,,2100.0,,,,1.0,,,,11,,,6.0,,,1.0,,,712,,,,,,,
,,,,,,,,,,,,,,,,,,,,,,,,,,,,,,,,,,,,,,,,,,,,,,,,,,,,,,,,,,,,,,,,,,,
,,6.0,,,,2013.0,,,,Desarrollo Económico,Recursos fiscales,Transporte,,Servicios de arrendamiento,"Supervisión, inspección y verificación del transporte terrestre, marítimo y aéreo",Comunicaciones y Transportes,Transporte por Ferrocarril,Gasto corriente,Centro SCT Baja California,Ferrocarriles eficientes y competitivos,,Regulación y supervisión,,,,,,,,,,3.0,1.0,5.0,,,,,G,6913.0,,,3200.0,,,,2.0,,,,9,,,3.0,,,1.0,,,622,,,,,,,
,,1.0,,,,2015.0,0,,Campeche,Gobierno,Recursos fiscales,Otros Servicios Generales,,"Maquinaria, otros equipos y herramientas",Censo de Población y Vivienda,Información Nacional Estadística y Geográfica,Servicios Estadísticos,Gasto de capital diferente de obra pública,Instituto Nacional de Estadística y Geografía,Sistema Nacional de Información Estadística y Geográfica,,"Planeación, seguimiento y evaluación de políticas públicas",,,,,4.0,,,,,1.0,1.0,8.0,,,,,P,"$1,000.00",,,5600.0,,,,4.0,,,,40,,,2.0,,,2.0,,,100,,,,,,,
,,4.0,,,,2010.0,,,,Gobierno,Recursos fiscales,Administración Pública,,Servicios de Mantenimiento y Conservación,"Asesoraría, coordinación, difusión y apoyo técnico de las actividades del Presidente de la República",Presidencia de la República,Presidencia,Gasto corriente,Oficina de la Presidencia de la República,"Asesoría, coordinación, difusión y apoyo de las actividades del Presidente de la República",,"Planeación, seguimiento y evaluación de políticas públicas",,,,,,,,,,1.0,1.0,8.0,,,,,P,311181.0,,,3500.0,,,,2.0,,,,2,,,4.0,,,1.0,,,129,,,,,,,
,,3.0,,,,2015.0,0,,Distrito Federal,Desarrollo Económico,Recursos fiscales,"Minería, Manufacturas y Construcción",,Servicios de traslado y viáticos,Promoción de la inversión en el sector minero y desarrollo de su competitividad,Economía,Extracción de Recursos Minerales excepto los Combustibles Minerales,Gasto corriente,Dirección General de Regulación Minera,"Micro, pequeñas y medianas empresas productivas y competitivas",,Promoción y fomento,,,,,9.0,,,,,3.0,1.0,4.0,,,,,F,"$20,000.00",,,3700.0,,,,1.0,,,,10,,,1.0,,,1.0,,,181,,,,,,,
,,1.0,,,,2015.0,0,,Distrito Federal,Gobierno,Recursos fiscales,Coordinación de la Política de Gobierno,,Seguridad social,Actividades de apoyo a la función pública y buen gobierno,Salud,Función Pública,Gasto corriente,Hospital Infantil de México Federico Gómez,Función pública y buen gobierno,,Apoyo a la función pública y al mejoramiento de la gestión,,,,,9.0,,,,,1.0,1.0,3.0,,,,,O,"$81,822.00",,,1400.0,,,,1.0,,,,12,,,4.0,,,1.0,,,NBG,,,,,,,
,,8.0,,,,2014.0,,,,Desarrollo Económico,Recursos fiscales,Comunicaciones,,Servicios basicos,"Supervisión, inspección y verificación del sistema Nacional e-México",Comunicaciones y Transportes,Comunicaciones,Gasto corriente,Centro SCT Baja California,Regulación eficiente de las comunicaciones y los transportes,,Regulación y supervisión,,,,,,,,,,3.0,1.0,6.0,,,,,G,"3,500.00",,,3100.0,,,,7.0,,,,9,,,1.0,,,1.0,,,622,,,,,,,
,,1.0,,,,2015.0,0,,Hidalgo,Gobierno,Recursos fiscales,Coordinación de la Política de Gobierno,,"Servicios de instalación, reparación, mantenimiento y conservación",Actualización del padrón electoral y expedición de la credencial para votar,Instituto Nacional Electoral,Organización de Procesos Electorales,Gasto corriente,Juntas Distritales Ejecutivas,"Democracia preservada y fortalecida mediante la organización de elecciones federales, el fomento de la participación ciudadana y la promoción del desarrollo del sistema de partidos",,Específicos,,,,,13.0,,,,,1.0,1.0,3.0,,,,,R,"$59,732.00",,,3500.0,,,,5.0,,,,22,,,6.0,,,1.0,,,300,,,,,,,
,,12.0,,,,2015.0,0,,Distrito Federal,Gobierno,Recursos fiscales,Coordinación de la Política de Gobierno,,Servicios de traslado y viáticos,Planeación demográfica del país,Gobernación,Población,Gasto corriente,Secretaría General del Consejo Nacional de Población,Planeación demográfica,,"Planeación, seguimiento y evaluación de políticas públicas",,,,,9.0,,,,,1.0,1.0,3.0,,,,,P,"$202,199.00",,,3700.0,,,,6.0,,,,4,,,7.0,,,1.0,,,G00,,,,,,,
Servicios de apoyo administrativo,2.0,,0,3300.0,"Servicios profesionales, cient¡ficos, tcnicos y otros servicios",2016.0,,,,,,,,,,,,,,,,,,,9.0,Distrito Federal,,1.0,8.0,Recursos fiscales,"Ciencia, Tecnolog¡a e Innovaci¢n",,,,3.0,Desarrollo Econ¢mico,,,,,M,Apoyo al proceso presupuestario y para mejorar la eficiencia institucional,," 1,302,106 ",1.0,Actividades de apoyo administrativo,,0.0,Comunicaciones y Transportes,Otros,9,2.0,Desarrollo Tecnol¢gico,,1.0,Gasto corriente,,JZN,Agencia Espacial Mexicana,,,,,,,,
,,,,,,,,,,,,,,,,,,,,,,,,,,,,,,,,,,,,,,,,,,,,,,,,,,,,,,,,,,,,,,,,,,,
,,,,,,,,,,,,,,,,,,,,,,,,,,,,,,,,,,,,,,,,,,,,,,,,,,,,,,,,,,,,,,,,,,,
,,7.0,,,,2015.0,0,,Colima,Desarrollo Social,Recursos fiscales,Educación,,Seguridad social,Administración y fomento de la educación naval,Marina,Otros Servicios Educativos y Actividades Inherentes,Gasto corriente,Dirección General de Recursos Humanos,Educación naval militar,,Funciones de las Fuerzas Armadas,,,,,6.0,,,,,2.0,1.0,5.0,,,,,A,"$200,452.00",,,1400.0,,,,6.0,,,,13,,,6.0,,,1.0,,,311,,,,,,,
,,3.0,,,,2015.0,0,,Distrito Federal,Gobierno,Recursos fiscales,Seguridad Nacional,,Servicios de traslado y viáticos,Servicios de inteligencia para la Seguridad Nacional,Gobernación,Inteligencia para la Preservación de la Seguridad Nacional,Gasto corriente,Centro de Investigación y Seguridad Nacional,Inteligencia para la Seguridad Nacional,,Prestación de Servicios Públicos,,,,,9.0,,,,,1.0,1.0,6.0,,,,,E,"$3,355,200.00",,,3700.0,,,,1.0,,,,4,,,3.0,,,1.0,,,I00,,,,,,,
,,1.0,,,,2008.0,,Función pública y buen gobierno,,,Recursos fiscales,Administración Pública,Gobierno,"Seguro de responsabilidad civil, asistencia legal y otros seguros",Actividades de apoyo a la función pública y buen gobierno,Medio Ambiente y Recursos Naturales,Función Pública,Gasto corriente,Comisión Nacional del Agua,,Actividades de apoyo a la función pública y al mejoramiento de la gestión,,,,,,,,,,,,1.0,8.0,,,1.0,O,,332526.0,,,1409.0,,,,1.0,,,,16,,,3.0,,,1.0,,,B00,,,,,,,
,,3.0,,,,2010.0,,,,Gobierno,Recursos fiscales,Administración Pública,,"Servicios Comercial, Bancario, Financiero, Subcontratación de Servicios con Terceros y Gastos Inherentes",Asesoramiento en materia jurídica al Presidente de la Republica y al Gobierno Federal.,Consejería Jurídica del Ejecutivo Federal,Asuntos Jurídicos,Gasto corriente,Consejería Jurídica del Ejecutivo Federal,Asesoría en materia jurídica al Presidente de la República y al Gobierno Federal,,"Planeación, seguimiento y evaluación de políticas públicas",,,,,,,,,,1.0,1.0,8.0,,,,,P,317938.0,,,3400.0,,,,1.0,,,,37,,,5.0,,,1.0,,,100,,,,,,,
,,3.0,,,,2014.0,,,,Gobierno,Recursos fiscales,Justicia,,Servicios de traslado y viaticos,Impartición de justicia laboral,Trabajo y Previsión Social,Impartición de Justicia,Gasto corriente,Junta Federal de Conciliación y Arbitraje,Impartición y procuración de la justicia laboral,,Prestación de Servicios Públicos,,,,,,,,,,1.0,1.0,2.0,,,,,E,"10,636,515.00",,,3700.0,,,,1.0,,,,14,,,1.0,,,1.0,,,110,,,,,,,
,,5.0,,,,2015.0,0,,Tlaxcala,Desarrollo Social,Recursos fiscales,Salud,,Remuneraciones adicionales y especiales,Capacitación y Formación de los Recursos Humanos en Salud,Instituto de Seguridad y Servicios Sociales de los Trabajadores del Estado,Prestación de Servicios de Salud a la Persona,Gasto corriente,Instituto de Seguridad y Servicios Sociales de los Trabajadores del Estado,Otros Servicios de Salud,,Prestación de Servicios Públicos,,,,,29.0,,,,,2.0,1.0,3.0,,,,,E,"$21,668.00",,,1300.0,,,,16.0,,,,51,,,2.0,,,1.0,,,GYN,,,,,,,
,,,,,,,,,,,,,,,,,,,,,,,,,,,,,,,,,,,,,,,,,,,,,,,,,,,,,,,,,,,,,,,,,,,
,,,,,,,,,,,,,,,,,,,,,,,,,,,,,,,,,,,,,,,,,,,,,,,,,,,,,,,,,,,,,,,,,,,
,,10.0,,,,2015.0,10096400008,,Oaxaca,Desarrollo Económico,Recursos fiscales,Transporte,,"Servicios de instalación, reparación, mantenimiento y conservación",Proyectos de infraestructura económica de carreteras alimentadoras y caminos rurales,Comunicaciones y Transportes,Transporte por Carretera,Gasto de obra pública,Centro SCT Oaxaca,"Carreteras alimentadoras y caminos rurales eficientes, seguras y suficientes",,Proyectos de Inversión,,,,,20.0,,,,,3.0,1.0,5.0,,,,,K,"$8,155.00",,,3500.0,,,,31.0,,,,9,,,1.0,,,3.0,,,640,,,,,,,
,,8.0,,,,2010.0,,,,Desarrollo Social,Recursos fiscales,Asistencia Social,,Materiales y Artículos de Construcción,"Definición y conducción de la política del desarrollo social, el ordenamiento territorial y la vivienda",Desarrollo Social,Otros Grupos Vulnerables,Gasto corriente,Delegación SEDESOL en Quintana Roo,"Apoyo al ingreso, a la salud y a la educación de las familias en pobreza",,"Planeación, seguimiento y evaluación de políticas públicas",,,,,,,,,,2.0,1.0,5.0,,,,,P,14900.0,,,2400.0,,,,2.0,,,,20,,,3.0,,,1.0,,,143,,,,,,,
,,10.0,,,,2015.0,45965,,Guerrero,Desarrollo Económico,Recursos fiscales,Transporte,,Servicios de traslado y viáticos,Proyectos de infraestructura económica de carreteras alimentadoras y caminos rurales,Comunicaciones y Transportes,Transporte por Carretera,Gasto de obra pública,Centro SCT Guerrero,"Carreteras alimentadoras y caminos rurales eficientes, seguras y suficientes",,Proyectos de Inversión,,,,,12.0,,,,,3.0,1.0,5.0,,,,,K,"$8,580.00",,,3700.0,,,,31.0,,,,9,,,1.0,,,3.0,,,632,,,,,,,
,,8.0,,,,2012.0,,,,Desarrollo Económico,Recursos fiscales,Comunicaciones,,Otras prestaciones sociales y economicas,Definición y conducción de la política de comunicaciones y transportes,Comunicaciones y Transportes,Comunicaciones,Gasto corriente,Centro SCT Nayarit,Regulación eficiente de las comunicaciones y los transportes,,"Planeación, seguimiento y evaluación de políticas públicas",,,,,,,,,,3.0,1.0,6.0,,,,,P,505161.0,,,1500.0,,,,1.0,,,,9,,,1.0,,,1.0,,,638,,,,,,,
,,,,,,,,,,,,,,,,,,,,,,,,,,,,,,,,,,,,,,,,,,,,,,,,,,,,,,,,,,,,,,,,,,,
,,4.0,,,,2014.0,,,,Desarrollo Social,Recursos fiscales,Educación,,Servicios de traslado y viaticos,Prestación de servicios de educación técnica,Educación Pública,Educación Media Superior,Gasto corriente,Centro de Enseñanza Técnica Industrial,Educación media superior de calidad,,Prestación de Servicios Públicos,,,,,,,,,,2.0,1.0,5.0,,,,,E,"400,000.00",,,3700.0,,,,8.0,,,,11,,,2.0,,,1.0,,,L3P,,,,,,,
,,,,,,,,,,,,,,,,,,,,,,,,,,,,,,,,,,,,,,,,,,,,,,,,,,,,,,,,,,,,,,,,,,,
,,9.0,,,,2009.0,,"Impulso a la Reconversión Productiva en Materia Agrícola, Pecuaria y Pesquera",,,,Desarrollo Agropecuario y Forestal,Desarrollo Económico,Primas de vacaciones y dominical,"Registro, Control y Seguimiento de los Programas Presupuestarios","Agricultura, Ganadería, Desarrollo Rural, Pesca y Alimentación",Apoyos a la Producción,,Dirección General de Administración de Riesgos y Proyectos de Inversión,,"Planeación, seguimiento y evaluación de políticas públicas",,Recursos fiscales,Gasto corriente,,,,,,,,,1.0,2.0,,,3.0,P,,93090.0,,,1305.0,,,,1.0,,,,8,,,1.0,,,1.0,,,211,,,,,,,
,,3.0,,,,2009.0,,Recursos derivados de los ingresos federales para las entidades federativas y municipios,,,,Recursos a Entidades Federativas,Otras,Morelos,Fondo de Fomento Municipal,Participaciones a Entidades Federativas y Municipios,Participaciones a Entidades Federativas,,Unidad de Coordinación con Entidades Federativas,,Participaciones a entidades federativas y municipios,,Recursos fiscales,Participaciones,,,,,,,,,1.0,1.0,,,4.0,C,,387991460.0,,,8217.0,,,,2.0,,,,28,,,1.0,,,4.0,,,114,,,,,,,
,,10.0,,,,2012.0,,,,Desarrollo Económico,Recursos fiscales,Transporte,,Otros servicios generales,Conservación de infraestructura de caminos rurales y carreteras alimentadoras,Comunicaciones y Transportes,Transporte por Carretera,Gasto de obra pública,Centro SCT Tamaulipas,"Carreteras alimentadoras y caminos rurales eficientes, seguras y suficientes",,Proyectos de Inversión,,,,,,,,,,3.0,1.0,5.0,,,,,K,5600.0,,,3900.0,,,,37.0,,,,9,,,1.0,,,3.0,,,648,,,,,,,
,,1.0,,,,2015.0,0,,Estado de México,Gobierno,Recursos fiscales,Coordinación de la Política de Gobierno,,Otras prestaciones sociales y económicas,Actividades de apoyo a la función pública y buen gobierno,Salud,Función Pública,Gasto corriente,Hospital Regional de Alta Especialidad de Ixtapaluca,Función pública y buen gobierno,,Apoyo a la función pública y al mejoramiento de la gestión,,,,,15.0,,,,,1.0,1.0,3.0,,,,,O,"$17,082.00",,,1500.0,,,,1.0,,,,12,,,4.0,,,1.0,,,NBU,,,,,,,
,,1.0,,,,2015.0,0,,Baja California Sur,Gobierno,Recursos fiscales,Coordinación de la Política de Gobierno,,Alimentos y utensilios,Organización electoral federal,Instituto Nacional Electoral,Organización de Procesos Electorales,Gasto corriente,Juntas Distritales Ejecutivas,"Democracia preservada y fortalecida mediante la organización de elecciones federales, el fomento de la participación ciudadana y la promoción del desarrollo del sistema de partidos",,Específicos,,,,,3.0,,,,,1.0,1.0,3.0,,,,,R,"$288,264.00",,,2200.0,,,,2.0,,,,22,,,6.0,,,1.0,,,300,,,,,,,
,,6.0,,,,2011.0,,,,Desarrollo Económico,Recursos fiscales,Desarrollo Agropecuario y Forestal,,"Herramientas, refacciones y accesorios menores","Registro, Control y Seguimiento de los Programas Presupuestarios","Agricultura, Ganadería, Desarrollo Rural, Pesca y Alimentación",Apoyos a la Producción,Gasto corriente,Delegación en Tlaxcala,Elevar el ingreso de los productores y el empleo rural,,"Planeación, seguimiento y evaluación de políticas públicas",,,,,,,,,,3.0,1.0,2.0,,,,,P,8910.0,,,2900.0,,,,1.0,,,,8,,,1.0,,,1.0,,,149,,,,,,,
,,,,,,,,,,,,,,,,,,,,,,,,,,,,,,,,,,,,,,,,,,,,,,,,,,,,,,,,,,,,,,,,,,,
,,10.0,,,,2015.0,12096350001,,Estado de México,Desarrollo Económico,Recursos fiscales,Transporte,,Otros servicios generales,Proyectos de infraestructura económica de carreteras alimentadoras y caminos rurales,Comunicaciones y Transportes,Transporte por Carretera,Gasto de obra pública,Centro SCT México,"Carreteras alimentadoras y caminos rurales eficientes, seguras y suficientes",,Proyectos de Inversión,,,,,15.0,,,,,3.0,1.0,5.0,,,,,K,$960.00,,,3900.0,,,,31.0,,,,9,,,1.0,,,3.0,,,635,,,,,,,
,,10.0,,,,2015.0,14096350016,,Estado de México,Desarrollo Económico,Recursos fiscales,Transporte,,"Materiales de administración, emisión de documentos y artículos oficiales",Proyectos de infraestructura económica de carreteras alimentadoras y caminos rurales,Comunicaciones y Transportes,Transporte por Carretera,Gasto de obra pública,Centro SCT México,"Carreteras alimentadoras y caminos rurales eficientes, seguras y suficientes",,Proyectos de Inversión,,,,,15.0,,,,,3.0,1.0,5.0,,,,,K,"$1,000.00",,,2100.0,,,,31.0,,,,9,,,1.0,,,3.0,,,635,,,,,,,
,,19.0,,,,2008.0,,Formación y capacitación de recursos humanos acordes a las necesidades y demandas de atención a la salud,,,Recursos fiscales,Salud,Desarrollo Social,Transferencias para asignaciones adicionales al sueldo,Capacitación técnica y gerencial de recursos humanos para la salud,Salud,Generación de Recursos para la Salud,Gasto corriente,Hospital Juárez de México,,Prestación de servicios públicos,,,,,,,,,,,,1.0,1.0,,,2.0,E,,825420.0,,,4332.0,,,,19.0,,,,12,,,3.0,,,1.0,,,NAW,,,,,,,
Servicios de apoyo administrativo,2.0,,0,2100.0,"Materiales de administraci¢n, emisi¢n de documentos y art¡culos oficiales",2016.0,,,,,,,,,,,,,,,,,,,9.0,Distrito Federal,,1.0,5.0,Recursos fiscales,Transporte,,,,3.0,Desarrollo Econ¢mico,,,,,M,Apoyo al proceso presupuestario y para mejorar la eficiencia institucional,," 23,174 ",1.0,Actividades de apoyo administrativo,,0.0,Comunicaciones y Transportes,Otros,9,6.0,Otros Relacionados con Transporte,,1.0,Gasto corriente,,650,Centro SCT Veracruz,,,,,,,,
,,6.0,,,,2013.0,,,,Desarrollo Económico,Recursos fiscales,"Agropecuaria, Silvicultura, Pesca y Caza",,Subsidios y subvenciones,Programa Nacional para el Control de la Abeja Africana,"Agricultura, Ganadería, Desarrollo Rural, Pesca y Alimentación",Agropecuaria,Gasto corriente,Coordinación General de Ganadería,Elevar el ingreso de los productores y el empleo rural,,Otros Subsidios,,,,,,,,,,3.0,1.0,2.0,,,,,U,3000000.0,,,4300.0,,,,10.0,,,,8,,,1.0,,,1.0,,,116,,,,,,,
,,5.0,,,,2015.0,0,,Tabasco,Desarrollo Económico,Recursos fiscales,"Asuntos Económicos, Comerciales y Laborales en General",,Seguridad social,Ejecución a nivel nacional de los programas y acciones de la Política Laboral,Trabajo y Previsión Social,Asuntos Laborales Generales,Gasto corriente,Delegación Federal del Trabajo en Tabasco,Instrumentación de la política Laboral,,Prestación de Servicios Públicos,,,,,27.0,,,,,3.0,1.0,1.0,,,,,E,"$60,765.00",,,1400.0,,,,3.0,,,,14,,,2.0,,,1.0,,,147,,,,,,,
,,,,,,,,,,,,,,,,,,,,,,,,,,,,,,,,,,,,,,,,,,,,,,,,,,,,,,,,,,,,,,,,,,,
,,4.0,,,,2014.0,,,,Desarrollo Social,Ingresos Propios,Salud,,Remuneraciones adicionales y especiales,Consulta Externa Especializada,Instituto de Seguridad y Servicios Sociales de los Trabajadores del Estado,Prestación de Servicios de Salud a la Persona,Gasto corriente,Instituto de Seguridad y Servicios Sociales de los Trabajadores del Estado,Cobertura de la atención médica curativa,,Prestación de Servicios Públicos,,,,,,,,,,2.0,4.0,3.0,,,,,E,"31,397,749.00",,,1300.0,,,,10.0,,,,GYN,,,2.0,,,1.0,,,GYN,,,,,,,
Funci¢n p£blica y buen gobierno,1.0,,0,2700.0,"Vestuario, blancos, prendas de protecci¢n y art¡culos deportivos",2016.0,,,,,,,,,,,,,,,,,,,9.0,Distrito Federal,,1.0,3.0,Recursos fiscales,Coordinaci¢n de la Pol¡tica de Gobierno,,,,1.0,Gobierno,,,,,O,Apoyo a la funci¢n p£blica y al mejoramiento de la gesti¢n,, 752 ,1.0,Actividades de apoyo a la funci¢n p£blica y buen gobierno,,0.0,Tribunales Agrarios,Otros,31,4.0,Funci¢n P£blica,,1.0,Gasto corriente,,300,Oficial¡a Mayor,,,,,,,,
,,3.0,,,,2014.0,,,,Gobierno,Recursos fiscales,Seguridad Nacional,,"Herramientas, refacciones y accesorios menores","Defensa de la Integridad, la Independencia, la Soberanía del Territorio Nacional",Defensa Nacional,Defensa,Gasto corriente,Comandancia I Región Militar,"Defensa de la integridad, la independencia, la soberanía del territorio nacional y la seguridad interior",,Funciones de las Fuerzas Armadas,,,,,,,,,,1.0,1.0,6.0,,,,,A,"2,990,809.00",,,2900.0,,,,2.0,,,,7,,,1.0,,,1.0,,,120,,,,,,,
,,3.0,,,,2015.0,0,,Nayarit,Desarrollo Social,Ingresos Propios,Salud,,"Materiales de administración, emisión de documentos y artículos oficiales",Atención a la salud reproductiva,Instituto Mexicano del Seguro Social,Prestación de Servicios de Salud a la Persona,Gasto corriente,Instituto Mexicano del Seguro Social,Eficacia en la atención médica preventiva,,Prestación de Servicios Públicos,,,,,18.0,,,,,2.0,4.0,3.0,,,,,E,"$7,101.00",,,2100.0,,,,8.0,,,,50,,,2.0,,,1.0,,,GYR,,,,,,,
"Democracia preservada y fortalecida mediante la organizaci¢n de elecciones federales, el fomento de la participaci¢n ciudadana y la promoci¢n del desarrollo del sistema de partidos",1.0,,0,1700.0,Pago de est¡mulos a servidores p£blicos,2016.0,,,,,,,,,,,,,,,,,,,12.0,Guerrero,,1.0,3.0,Recursos fiscales,Coordinaci¢n de la Pol¡tica de Gobierno,,,,1.0,Gobierno,,,,,R,Espec¡ficos,," 119,652 ",2.0,Organizaci¢n electoral federal,,0.0,Instituto Nacional Electoral,Otros,22,6.0,Organizaci¢n de Procesos Electorales,,1.0,Gasto corriente,,300,Juntas Distritales Ejecutivas,,,,,,,,
,,8.0,,,,2009.0,,Regulación eficiente de las comunicaciones y los transportes,,,,Comunicaciones y Transportes,Desarrollo Económico,Gratificación de fin de año,"Supervisión, inspección y verificación del transporte terrestre, marítimo y aéreo",Comunicaciones y Transportes,Otros,,Centro SCT Guerrero,,Regulación y supervisión,,Recursos fiscales,Gasto corriente,,,,,,,,,1.0,1.0,,,3.0,G,,334004.0,,,1306.0,,,,2.0,,,,9,,,6.0,,,1.0,,,632,,,,,,,
,,,,,,,,,,,,,,,,,,,,,,,,,,,,,,,,,,,,,,,,,,,,,,,,,,,,,,,,,,,,,,,,,,,
,,4.0,,,,2013.0,,,,Gobierno,Recursos fiscales,Justicia,,"Servicios profesionales, cientificos, tecnicos y otros servicios",Investigar y perseguir los delitos del orden federal,Procuraduría General de la República,Procuración de Justicia,Gasto corriente,Procuraduría General de la República,Investigación del delito federal,,Prestación de Servicios Públicos,,,,,,,,,,1.0,1.0,2.0,,,,,E,4837000.0,,,3300.0,,,,2.0,,,,17,,,2.0,,,1.0,,,100,,,,,,,
,,4.0,,,,2012.0,,,,Gobierno,Recursos fiscales,Relaciones Exteriores,,"Servicios profesionales, cientificos, tecnicos y otros servicios","Promoción y defensa de los intereses de México en el exterior, en los ámbitos bilateral y regional",Relaciones Exteriores,Relaciones Exteriores,Gasto corriente,Subsecretaría para América Latina y el Caribe,Vínculos políticos con el exterior que benefician los intereses nacionales,,"Planeación, seguimiento y evaluación de políticas públicas",,,,,,,,,,1.0,1.0,4.0,,,,,P,14370100.0,,,3300.0,,,,4.0,,,,5,,,1.0,,,1.0,,,300,,,,,,,
,,1.0,,,,2015.0,0,,Morelos,Gobierno,Recursos fiscales,Coordinación de la Política de Gobierno,,Remuneraciones adicionales y especiales,Actividades de apoyo a la función pública y buen gobierno,Medio Ambiente y Recursos Naturales,Función Pública,Gasto corriente,Instituto Mexicano de Tecnología del Agua,Función pública y buen gobierno,,Apoyo a la función pública y al mejoramiento de la gestión,,,,,17.0,,,,,1.0,1.0,3.0,,,,,O,"$9,600.00",,,1300.0,,,,1.0,,,,16,,,4.0,,,1.0,,,RJE,,,,,,,
,,,,,,,,,,,,,,,,,,,,,,,,,,,,,,,,,,,,,,,,,,,,,,,,,,,,,,,,,,,,,,,,,,,
,,3.0,,,,2010.0,,,,Desarrollo Económico,Recursos fiscales,Temas Empresariales,,Pago de Estímulos a Servidores Públicos,Atención a las solicitudes de servicios y promoción de los programas competencia de la Secretaría en el interior de la República,Economía,"Micro, Pequeñas y Medianas Empresas",Gasto corriente,Delegación en San Luis Potosí,"Micro, Pequeñas y Medianas Empresas producctivas y competitivas",,Prestación de Servicios Públicos,,,,,,,,,,3.0,1.0,4.0,,,,,E,2185.0,,,1700.0,,,,9.0,,,,10,,,1.0,,,1.0,,,744,,,,,,,
,,,,,,,,,,,,,,,,,,,,,,,,,,,,,,,,,,,,,,,,,,,,,,,,,,,,,,,,,,,,,,,,,,,
,,,,,,,,,,,,,,,,,,,,,,,,,,,,,,,,,,,,,,,,,,,,,,,,,,,,,,,,,,,,,,,,,,,
,,5.0,,,,2011.0,,,,Gobierno,Recursos fiscales,Administración Pública,,"Materiales de administracion, emision de documentos y articulos oficiales","Mejora de la gestión y regulación de los procesos, trámites y servicios de la Administración Pública Federal",Función Pública,Función Pública,Gasto corriente,Dirección General de Tecnologías de Información,Mejora de la Gestión Pública,,Apoyo a la función pública y al mejoramiento de la gestión,,,,,,,,,,1.0,1.0,8.0,,,,,O,1262300.0,,,2100.0,,,,5.0,,,,27,,,3.0,,,1.0,,,511,,,,,,,
,,3.0,,,,2011.0,,,,Gobierno,Recursos fiscales,"Orden, Seguridad y Justicia",,"Materiales de administracion, emision de documentos y articulos oficiales",Desarrollo de instrumentos para la prevención del delito,Seguridad Pública,Policía,Gasto corriente,Subsecretaría de Planeación y Protección Institucional,Prevención del delito con perspectiva nacional,,Prestación de Servicios Públicos,,,,,,,,,,1.0,1.0,6.0,,,,,E,15500.0,,,2100.0,,,,1.0,,,,36,,,1.0,,,1.0,,,300,,,,,,,
