,,2.0,,,,2008.0,,Servicios de apoyo administrativo,,,Recursos fiscales,Administración Pública,Gobierno,Aportaciones al seguro de cesantía en edad avanzada y vejez,Actividades de apoyo administrativo,Presidencia de la República,Presidencia,Gasto corriente,Coordinación General de Administración,,Actividades de apoyo al proceso presupuestario y para mejorar la eficiencia institucional,,,,,,,,,,,,1.0,8.0,,,1.0,M,,908196.0,,,1414.0,,,,1.0,,,,2,,,4.0,,,1.0,,,113,,,,,,,
,,2.0,,,,2008.0,,Servicios de apoyo administrativo,,,Recursos fiscales,Salud,Desarrollo Social,"Seguro de responsabilidad civil, asistencia legal y otros seguros",Actividades de apoyo administrativo,Salud,Rectoría del Sistema de Salud,Gasto corriente,Servicios de Atención Psiquiátrica,,Actividades de apoyo al proceso presupuestario y para mejorar la eficiencia institucional,,,,,,,,,,,,1.0,1.0,,,2.0,M,,18144.0,,,1409.0,,,,1.0,,,,12,,,4.0,,,1.0,,,N00,,,,,,,
,,10.0,,,,2015.0,11096270002,,Chiapas,Desarrollo Económico,Recursos fiscales,Transporte,,"Servicios de instalación, reparación, mantenimiento y conservación",Proyectos de infraestructura económica de carreteras alimentadoras y caminos rurales,Comunicaciones y Transportes,Transporte por Carretera,Gasto de obra pública,Centro SCT Chiapas,"Carreteras alimentadoras y caminos rurales eficientes, seguras y suficientes",,Proyectos de Inversión,,,,,7.0,,,,,3.0,1.0,5.0,,,,,K,"$10,560.00",,,3500.0,,,,31.0,,,,9,,,1.0,,,3.0,,,627,,,,,,,
,,3.0,,,,2014.0,,,,Desarrollo Social,Recursos fiscales,Educación,,Seguridad social,Evaluaciones confiables de la calidad educativa y difusión oportuna de sus resultados,Instituto Nacional para la Evaluación de la Educación,Educación Básica,Gasto corriente,Unidad de Normatividad y Política Educativa,Evaluación del Sistema Educativo Nacional. Educación Básica,,Prestación de Servicios Públicos,,,,,,,,,,2.0,1.0,5.0,,,,,E,"22,863.00",,,1400.0,,,,35.0,,,,42,,,1.0,,,1.0,,,200,,,,,,,
,,1.0,,,,2015.0,0,,Nuevo León,Gobierno,Recursos fiscales,Coordinación de la Política de Gobierno,,Servicios básicos,"Dirección, soporte jurídico electoral y apoyo logístico",Instituto Nacional Electoral,Organización de Procesos Electorales,Gasto corriente,Juntas Distritales Ejecutivas,"Democracia preservada y fortalecida mediante la organización de elecciones federales, el fomento de la participación ciudadana y la promoción del desarrollo del sistema de partidos",,Específicos,,,,,19.0,,,,,1.0,1.0,3.0,,,,,R,$600.00,,,3100.0,,,,8.0,,,,22,,,6.0,,,1.0,,,300,,,,,,,
,,4.0,,,,2012.0,,,,Gobierno,Recursos fiscales,Justicia,,Seguridad social,Investigar y perseguir los delitos del orden federal,Procuraduría General de la República,Procuración de Justicia,Gasto corriente,Delegación Estatal en Guerrero,Investigación del delito federal,,Prestación de Servicios Públicos,,,,,,,,,,1.0,1.0,2.0,,,,,E,5960987.0,,,1400.0,,,,2.0,,,,17,,,2.0,,,1.0,,,332,,,,,,,
,,3.0,,,,2015.0,0,,Distrito Federal,Desarrollo Económico,Recursos fiscales,"Ciencia, Tecnología e Innovación",,"Servicios profesionales, científicos, técnicos y otros servicios",Realización de investigación científica y elaboración de publicaciones,Consejo Nacional de Ciencia y Tecnología,Investigación Científica,Gasto corriente,Centro de Investigaciones y Estudios Superiores en Antropología Social,Generación de conocimiento científico para el bienestar de la población y difusión de sus resultados,,Prestación de Servicios Públicos,,,,,9.0,,,,,3.0,1.0,8.0,,,,,E,"$535,920.00",,,3300.0,,,,1.0,,,,38,,,1.0,,,1.0,,,90W,,,,,,,
,,3.0,,,,2008.0,,"Defensa de la integridad, la independencia, la soberanía del territorio nacional y la seguridad interior",,,Recursos fiscales,Soberanía,Gobierno,Productos Alimenticios,"Defensa de la Integridad, la Independencia, la Soberanía del Territorio Nacional ",Defensa Nacional,Defensa,Gasto corriente,Comandancia I Región Militar,,Otras actividades relevantes,,,,,,,,,,,,1.0,1.0,,,1.0,R,,260957469.0,,,2200.0,,,,2.0,,,,7,,,1.0,,,1.0,,,120,,,,,,,
,,3.0,,,,2015.0,0,,Coahuila,Gobierno,Recursos fiscales,Justicia,,Alimentos y utensilios,Impartición de justicia laboral,Trabajo y Previsión Social,Impartición de Justicia,Gasto corriente,Junta Federal de Conciliación y Arbitraje,Impartición y procuración de la justicia laboral,,Prestación de Servicios Públicos,,,,,5.0,,,,,1.0,1.0,2.0,,,,,E,"$8,722.00",,,2200.0,,,,1.0,,,,14,,,1.0,,,1.0,,,110,,,,,,,
,,,,,,,,,,,,,,,,,,,,,,,,,,,,,,,,,,,,,,,,,,,,,,,,,,,,,,,,,,,,,,,,,,,
,,3.0,,,,2015.0,0,,Distrito Federal,Desarrollo Social,Recursos fiscales,Protección Ambiental,,"Servicios profesionales, científicos, técnicos y otros servicios",Manejo Integral del Sistema Hidrológico,Medio Ambiente y Recursos Naturales,Administración del Agua,Gasto corriente,Comisión Nacional del Agua,Manejo eficiente y sustentable del agua y prevención de inundaciones,,Prestación de Servicios Públicos,,,,,9.0,,,,,2.0,1.0,1.0,,,,,E,"$1,460,053.00",,,3300.0,,,,6.0,,,,16,,,2.0,,,1.0,,,B00,,,,,,,
,,9.0,,,,2014.0,,,,Desarrollo Económico,Recursos fiscales,"Agropecuaria, Silvicultura, Pesca y Caza",,"Materiales de administracion, emision de documentos y articulos oficiales","Registro, Control y Seguimiento de los Programas Presupuestarios","Agricultura, Ganadería, Desarrollo Rural, Pesca y Alimentación",Agropecuaria,Gasto corriente,Dirección General de Tecnologías de la Información y Comunicaciones,"Impulso a la reconversión productiva en materia agrícola, pecuaria y pesquera",,"Planeación, seguimiento y evaluación de políticas públicas",,,,,,,,,,3.0,1.0,2.0,,,,,P,"7,905.00",,,2100.0,,,,1.0,,,,8,,,1.0,,,1.0,,,513,,,,,,,
,,4.0,,,,2008.0,,Capacitación y Productividad,,,Recursos fiscales,Temas Laborales,Desarrollo Económico,Gratificación de fin de año,Capacitación a trabajadores en activo,Trabajo y Previsión Social,Capacitación Laboral,Gasto corriente,Dirección General de Capacitación,,Prestación de servicios públicos,,,,,,,,,,,,1.0,3.0,,,3.0,E,,588490.0,,,1306.0,,,,4.0,,,,14,,,1.0,,,1.0,,,411,,,,,,,
,,5.0,,,,2009.0,,Instrumentación de la política Laboral,,,,Temas Laborales,Desarrollo Económico,Sueldos base,Ejecución a nivel nacional de los programas y acciones de la Política Laboral,Trabajo y Previsión Social,Otros,,Delegación Federal del Trabajo en el Distrito Federal,,Prestación de Servicios Públicos,,Recursos fiscales,Gasto corriente,,,,,,,,,1.0,3.0,,,3.0,E,,8814495.0,,,1103.0,,,,3.0,,,,14,,,3.0,,,1.0,,,153,,,,,,,
,,4.0,,,,2012.0,,,,Gobierno,Recursos fiscales,Asuntos Financieros y Hacendarios,,Remuneraciones al personal de caracter permanente,"Diseño e instrumentación de las políticas y estrategias en materia de programación, presupuesto, gasto público federal, contabilidad y rendición de cuentas de la gestión del sector público",Hacienda y Crédito Público,Asuntos Hacendarios,Gasto corriente,Unidad de Inversiones,Gasto público transparente y orientado a resultados,,"Planeación, seguimiento y evaluación de políticas públicas",,,,,,,,,,1.0,1.0,5.0,,,,,P,7509795.0,,,1100.0,,,,2.0,,,,6,,,2.0,,,1.0,,,410,,,,,,,
,,1.0,,,,2015.0,0,,Distrito Federal,Gobierno,Recursos fiscales,Coordinación de la Política de Gobierno,,Remuneraciones al personal de carácter permanente,Actividades de apoyo a la función pública y buen gobierno,Desarrollo Social,Función Pública,Gasto corriente,Instituto Mexicano de la Juventud,Función pública y buen gobierno,,Apoyo a la función pública y al mejoramiento de la gestión,,,,,9.0,,,,,1.0,1.0,3.0,,,,,O,"$423,280.00",,,1100.0,,,,1.0,,,,20,,,4.0,,,1.0,,,VUY,,,,,,,
,,6.0,,,,2010.0,,,,Desarrollo Económico,Recursos fiscales,Comunicaciones y Transportes,,Materiales y Útiles de Administración y de Enseñanza,"Supervisión, inspección y verificación del transporte terrestre, marítimo y aéreo",Comunicaciones y Transportes,Ferrocarriles,Gasto corriente,Centro SCT Coahuila,Ferrocarriles eficientes y competitivos,,Regulación y supervisión,,,,,,,,,,3.0,1.0,1.0,,,,,G,90000.0,,,2100.0,,,,2.0,,,,9,,,4.0,,,1.0,,,625,,,,,,,
,,4.0,,,,2015.0,0,,Jalisco,Desarrollo Económico,Recursos fiscales,"Ciencia, Tecnología e Innovación",,"Servicios de instalación, reparación, mantenimiento y conservación",Desarrollo tecnológico e innovación y elaboración de publicaciones,Consejo Nacional de Ciencia y Tecnología,Desarrollo Tecnológico,Gasto corriente,"Centro de Investigación y Asistencia en Tecnología y Diseño del Estado de Jalisco, A.C.",Generación de desarrollo e innovación tecnológica para elevar la competitividad del país y difusión de sus resultados,,Prestación de Servicios Públicos,,,,,14.0,,,,,3.0,1.0,8.0,,,,,E,"$73,320.00",,,3500.0,,,,2.0,,,,38,,,2.0,,,1.0,,,90I,,,,,,,
,,8.0,,,,2014.0,,,,Desarrollo Económico,Recursos fiscales,Transporte,,"Productos quimicos, farmaceuticos y de laboratorio",Regulación y supervisión del programa de protección y medicina preventiva en transporte multimodal,Comunicaciones y Transportes,Otros Relacionados con Transporte,Gasto corriente,Centro SCT Coahuila,Regulación eficiente de las comunicaciones y los transportes,,Regulación y supervisión,,,,,,,,,,3.0,1.0,5.0,,,,,G,"300,000.00",,,2500.0,,,,1.0,,,,9,,,6.0,,,1.0,,,625,,,,,,,
,,1.0,,,,2015.0,0,,Nuevo León,Gobierno,Recursos fiscales,Coordinación de la Política de Gobierno,,"Combustibles, lubricantes y aditivos",Organización electoral federal,Instituto Nacional Electoral,Organización de Procesos Electorales,Gasto corriente,Juntas Distritales Ejecutivas,"Democracia preservada y fortalecida mediante la organización de elecciones federales, el fomento de la participación ciudadana y la promoción del desarrollo del sistema de partidos",,Específicos,,,,,19.0,,,,,1.0,1.0,3.0,,,,,R,"$317,701.00",,,2600.0,,,,2.0,,,,22,,,6.0,,,1.0,,,300,,,,,,,
Producci¢n y Protecci¢n Forestal,4.0,,0,3200.0,Servicios de arrendamiento,2016.0,,,,,,,,,,,,,,,,,,,24.0,San Luis Potos¡,,1.0,2.0,Recursos fiscales,"Agropecuaria, Silvicultura, Pesca y Caza",,,,3.0,Desarrollo Econ¢mico,,,,,E,Prestaci¢n de Servicios P£blicos,," 452,700 ",14.0,Protecci¢n Forestal,,0.0,Medio Ambiente y Recursos Naturales,Otros,16,2.0,Silvicultura,,1.0,Gasto corriente,,RHQ,Comisi¢n Nacional Forestal,,,,,,,,
,,4.0,,,,2011.0,,,,Gobierno,Recursos fiscales,"Orden, Seguridad y Justicia",,Servicios de comunicacion social y publicidad,Investigar y perseguir los delitos del orden federal,Procuraduría General de la República,Procuración de Justicia,Gasto corriente,Dirección General de Comunicación Social,Investigación del delito federal,,Prestación de Servicios Públicos,,,,,,,,,,1.0,1.0,6.0,,,,,E,124000000.0,,,3600.0,,,,2.0,,,,17,,,3.0,,,1.0,,,110,,,,,,,
,,4.0,,,,2014.0,,,,Gobierno,Recursos fiscales,Justicia,,Servicios de traslado y viaticos,Investigar y perseguir los delitos del orden federal,Procuraduría General de la República,Procuración de Justicia,Gasto corriente,Policía Federal Ministerial,Investigación del delito federal,,Prestación de Servicios Públicos,,,,,,,,,,1.0,1.0,2.0,,,,,E,"2,500,000.00",,,3700.0,,,,2.0,,,,17,,,2.0,,,1.0,,,120,,,,,,,
,,10.0,,,,2015.0,45626,,Zacatecas,Desarrollo Económico,Recursos fiscales,Transporte,,Obra pública en bienes propios,Proyectos de infraestructura económica de carreteras alimentadoras y caminos rurales,Comunicaciones y Transportes,Transporte por Carretera,Gasto de obra pública,Centro SCT Zacatecas,"Carreteras alimentadoras y caminos rurales eficientes, seguras y suficientes",,Proyectos de Inversión,,,,,32.0,,,,,3.0,1.0,5.0,,,,,K,"$4,802,000.00",,,6200.0,,,,31.0,,,,9,,,1.0,,,3.0,,,652,,,,,,,
,,1.0,,,,2008.0,,"Democracia preservada y fortalecida mediante la organización de elecciones federales, el fomento de la participación ciudadana y la promoción del desarrollo del sistema de partidos",,,Recursos fiscales,Gobernación,Gobierno,Estímulos al personal operativo,Capacitar y educar para el ejercicio democrático de la ciudadanía,Instituto Federal Electoral,Organización de Procesos Electorales,Gasto corriente,Juntas Locales,,Otras actividades relevantes,,,,,,,,,,,,1.0,4.0,,,1.0,R,,1216142.0,,,1702.0,,,,3.0,,,,22,,,1.0,,,1.0,,,200,,,,,,,
,,8.0,,,,2015.0,0,,Yucatán,Desarrollo Económico,Recursos fiscales,Transporte,,"Materiales de administración, emisión de documentos y artículos oficiales",Regulación y supervisión del programa de protección y medicina preventiva en transporte multimodal,Comunicaciones y Transportes,Otros Relacionados con Transporte,Gasto corriente,Centro SCT Yucatán,Regulación eficiente de las comunicaciones y los transportes,,Regulación y supervisión,,,,,31.0,,,,,3.0,1.0,5.0,,,,,G,"$6,000.00",,,2100.0,,,,1.0,,,,9,,,6.0,,,1.0,,,651,,,,,,,
,,3.0,,,,2009.0,,"Defensa de la integridad, la independencia, la soberanía del territorio nacional y la seguridad interior",,,,Soberanía,Gobierno,Compensación garantizada,"Defensa de la Integridad, la Independencia, la Soberanía del Territorio Nacional",Defensa Nacional,Defensa,,Comandancia IV Región Militar,,Funciones de las Fuerzas Armadas,,Recursos fiscales,Gasto corriente,,,,,,,,,1.0,1.0,,,1.0,A,,125872063.0,,,1509.0,,,,2.0,,,,7,,,1.0,,,1.0,,,123,,,,,,,
,,8.0,,,,2015.0,0,,Nayarit,Desarrollo Social,Recursos fiscales,Protección Social,,Seguridad social,"Definición y conducción de la política del desarrollo social y comunitario, así como la participación social",Desarrollo Social,Otros Grupos Vulnerables,Gasto corriente,Delegación SEDESOL en Nayarit,"Apoyo al ingreso, a la salud y a la educación de las familias en pobreza",,"Planeación, seguimiento y evaluación de políticas públicas",,,,,18.0,,,,,2.0,1.0,6.0,,,,,P,"$123,246.00",,,1400.0,,,,2.0,,,,20,,,8.0,,,1.0,,,138,,,,,,,
,,3.0,,,,2015.0,0,,Distrito Federal,Desarrollo Económico,Recursos fiscales,Combustibles y Energía,,Otros servicios generales,"Realizar estudios de evaluación, cuantificación y verificación de las reservas de hidrocarburos",Comisión Nacional de Hidrocarburos,Petróleo y Gas Natural (Hidrocarburos),Gasto corriente,Dirección General de Medición,Regulación Eficiente del Sector Energético,,"Planeación, seguimiento y evaluación de políticas públicas",,,,,9.0,,,,,3.0,1.0,3.0,,,,,P,"$2,367.00",,,3900.0,,,,1.0,,,,46,,,2.0,,,1.0,,,253,,,,,,,
Regulaci¢n eficiente de las comunicaciones y los transportes,8.0,,0,3100.0,Servicios b sicos,2016.0,,,,,,,,,,,,,,,,,,,13.0,Hidalgo,,1.0,5.0,Recursos fiscales,Transporte,,,,3.0,Desarrollo Econ¢mico,,,,,P,"Planeaci¢n, seguimiento y evaluaci¢n de pol¡ticas p£blicas",," 12,195 ",1.0,"Definici¢n, conducci¢n y supervisi¢n de la pol¡tica de comunicaciones y transportes",,0.0,Comunicaciones y Transportes,Otros,9,4.0,Transporte Areo,,1.0,Gasto corriente,,633,Centro SCT Hidalgo,,,,,,,,
,,13.0,,,,2008.0,,Préstamos Hipotecarios y FOVISSSTE,,,Ingresos Propios,"Urbanización,  Vivienda y Desarrollo Regional",Desarrollo Social,"Servicios Comercial, Bancario, Financiero, Subcontratación de Servicios con Terceros y Gastos Inherentes",Gastos Operativos Institucionales,Instituto de Seguridad y Servicios Sociales de los Trabajadores del Estado,Vivienda,Gasto corriente,Instituto de Seguridad y Servicios Sociales de los Trabajadores del Estado,,Actividades de apoyo al proceso presupuestario y para mejorar la eficiencia institucional,,,,,,,,,,,,4.0,3.0,,,2.0,M,,61182387.0,,,3400.0,,,,2.0,,,,GYN,,,2.0,,,1.0,,,GYN,,,,,,,
"Democracia preservada y fortalecida mediante la organizaci¢n de elecciones federales, el fomento de la participaci¢n ciudadana y la promoci¢n del desarrollo del sistema de partidos",1.0,,0,2200.0,Alimentos y utensilios,2016.0,,,,,,,,,,,,,,,,,,,12.0,Guerrero,,1.0,3.0,Recursos fiscales,Coordinaci¢n de la Pol¡tica de Gobierno,,,,1.0,Gobierno,,,,,R,Espec¡ficos,," 9,860 ",2.0,Organizaci¢n electoral federal,,0.0,Instituto Nacional Electoral,Otros,22,6.0,Organizaci¢n de Procesos Electorales,,1.0,Gasto corriente,,200,Juntas Locales Ejecutivas,,,,,,,,
,,4.0,,,,2015.0,0,,Yucatán,Gobierno,Recursos fiscales,Justicia,,Alimentos y utensilios,Investigar y perseguir los delitos del orden federal,Procuraduría General de la República,Procuración de Justicia,Gasto corriente,Delegación Estatal en Yucatán,Investigación del delito federal,,Prestación de Servicios Públicos,,,,,31.0,,,,,1.0,1.0,2.0,,,,,E,"$47,000.00",,,2200.0,,,,2.0,,,,17,,,2.0,,,1.0,,,351,,,,,,,
,,7.0,,,,2008.0,,Regulación de las actividades económicas y sociales para la protección del medio ambiente y recursos naturales.,,,Recursos fiscales,Desarrollo Sustentable,Desarrollo Económico,Aportaciones al ISSSTE,"Regulación del aprovechamiento sustentable de los recursos, ambientes y ecosistemas naturales",Medio Ambiente y Recursos Naturales,Protección y Conservación del Medio Ambiente y los Recursos Naturales,Gasto corriente,Dirección General de Vida Silvestre,,Regulación y supervisión,,,,,,,,,,,,1.0,9.0,,,3.0,G,,1652404.0,,,1401.0,,,,2.0,,,,16,,,2.0,,,1.0,,,713,,,,,,,
,,5.0,,,,2009.0,,Mejora de la Gestión Pública,,,,Administración Pública,Gobierno,Cuotas para el seguro de gastos médicos del personal civil,"Optimización en el uso, control y aprovechamiento de los inmuebles federales, así como la valuación de bienes nacionales",Función Pública,Patrimonio Nacional,,Instituto de Administración y Avalúos de Bienes Nacionales,,Apoyo a la función pública y al mejoramiento de la gestión,,Recursos fiscales,Gasto corriente,,,,,,,,,1.0,8.0,,,1.0,O,,1150966.0,,,1406.0,,,,7.0,,,,27,,,2.0,,,1.0,,,A00,,,,,,,
,,10.0,,,,2008.0,,Diseño y aplicación de la política educativa,,,Recursos fiscales,Educación,Desarrollo Social,"Combustibles, Lubricantes y Aditivos",Diseño y aplicación de la política educativa,Educación Pública,Apoyo en Servicios Educativos Concurrentes,Gasto corriente,Oficina de Servicios Federales de Apoyo a la Educación en el Estado de Colima,,"Planeación, formulación, implementación, seguimiento y evaluación de políticas públicas",,,,,,,,,,,,1.0,0.0,,,2.0,P,,29889.0,,,2600.0,,,,1.0,,,,11,,,8.0,,,1.0,,,126,,,,,,,
,,3.0,,,,2014.0,,,,Desarrollo Económico,Recursos fiscales,Transporte,,Materiales y articulos de construccion y de reparacion,Proyectos de infraestructura económica de carreteras,Comunicaciones y Transportes,Transporte por Carretera,Gasto de obra pública,Centro SCT Querétaro,"Carreteras eficientes, seguras y suficientes",,Proyectos de Inversión,,,,,,,,,,3.0,1.0,5.0,,,,,K,"16,500.00",,,2400.0,,,,3.0,,,,9,,,1.0,,,3.0,,,642,,,,,,,
,,10.0,,,,2014.0,,,,Desarrollo Social,Recursos fiscales,Educación,,"Servicios financieros, bancarios y comerciales",Diseño y aplicación de la política educativa,Educación Pública,Otros Servicios Educativos y Actividades Inherentes,Gasto corriente,Subsecretaría de Planeación y Evaluación de Políticas Educativas,Diseño y aplicación de la política educativa,,"Planeación, seguimiento y evaluación de políticas públicas",,,,,,,,,,2.0,1.0,5.0,,,,,P,"140,813.00",,,3400.0,,,,1.0,,,,11,,,6.0,,,1.0,,,200,,,,,,,
,,4.0,,,,2013.0,,,,Gobierno,Recursos fiscales,Relaciones Exteriores,,Servicios de arrendamiento,Diseño y conducción de la política exterior de México,Relaciones Exteriores,Relaciones Exteriores,Gasto corriente,Dirección General del Acervo Histórico Diplomático,Vínculos políticos con el exterior que benefician los intereses nacionales,,"Planeación, seguimiento y evaluación de políticas públicas",,,,,,,,,,1.0,1.0,4.0,,,,,P,55000.0,,,3200.0,,,,2.0,,,,5,,,1.0,,,1.0,,,123,,,,,,,
,,10.0,,,,2015.0,12096390002,,Nuevo León,Desarrollo Económico,Recursos fiscales,Transporte,,"Materiales de administración, emisión de documentos y artículos oficiales",Proyectos de infraestructura económica de carreteras alimentadoras y caminos rurales,Comunicaciones y Transportes,Transporte por Carretera,Gasto de obra pública,Centro SCT Nuevo León,"Carreteras alimentadoras y caminos rurales eficientes, seguras y suficientes",,Proyectos de Inversión,,,,,19.0,,,,,3.0,1.0,5.0,,,,,K,"$9,600.00",,,2100.0,,,,31.0,,,,9,,,1.0,,,3.0,,,639,,,,,,,
,,,,,,,,,,,,,,,,,,,,,,,,,,,,,,,,,,,,,,,,,,,,,,,,,,,,,,,,,,,,,,,,,,,
,,10.0,,,,2015.0,14096270002,,Chiapas,Desarrollo Económico,Recursos fiscales,Transporte,,"Materiales de administración, emisión de documentos y artículos oficiales",Proyectos de infraestructura económica de carreteras alimentadoras y caminos rurales,Comunicaciones y Transportes,Transporte por Carretera,Gasto de obra pública,Centro SCT Chiapas,"Carreteras alimentadoras y caminos rurales eficientes, seguras y suficientes",,Proyectos de Inversión,,,,,7.0,,,,,3.0,1.0,5.0,,,,,K,"$1,000.00",,,2100.0,,,,31.0,,,,9,,,1.0,,,3.0,,,627,,,,,,,
,,5.0,,,,2015.0,0,,Distrito Federal,Desarrollo Económico,Recursos fiscales,Turismo,,Servicios básicos,Servicios de asistencia integral e información turística,Turismo,Turismo,Gasto corriente,Corporación de Servicios al Turista Ángeles Verdes,Atención y trato a los turistas,,Prestación de Servicios Públicos,,,,,9.0,,,,,3.0,1.0,7.0,,,,,E,"$1,470,781.00",,,3100.0,,,,5.0,,,,21,,,1.0,,,1.0,,,B00,,,,,,,
,,16.0,,,,2015.0,0,,Veracruz,Desarrollo Social,Recursos fiscales,Protección Social,,"Herramientas, refacciones y accesorios menores",Fomento del patrimonio cultural Indígena,Hacienda y Crédito Público,Indígenas,Gasto corriente,Comisión Nacional para el Desarrollo de los Pueblos Indígenas,Promoción y coordinación de las políticas publicas para el desarrollo de los pueblos y comunidades indígenas,,Promoción y fomento,,,,,30.0,,,,,2.0,1.0,6.0,,,,,F,"$35,000.00",,,2900.0,,,,31.0,,,,6,,,7.0,,,1.0,,,AYB,,,,,,,
,,5.0,,,,2010.0,,,,Desarrollo Económico,Recursos fiscales,Comunicaciones y Transportes,,Remuneraciones al Personal de Carácter Permanente,"Supervisión, inspección y verificación del transporte terrestre, marítimo y aéreo",Comunicaciones y Transportes,Aeropuertos,Gasto corriente,Centro SCT Campeche,Aeropuertos eficientes y competitivos,,Regulación y supervisión,,,,,,,,,,3.0,1.0,1.0,,,,,G,722499.0,,,1100.0,,,,2.0,,,,9,,,3.0,,,1.0,,,624,,,,,,,
,,,,,,,,,,,,,,,,,,,,,,,,,,,,,,,,,,,,,,,,,,,,,,,,,,,,,,,,,,,,,,,,,,,
Instrumentaci¢n de la pol¡tica Laboral,5.0,,0,1400.0,Seguridad social,2016.0,,,,,,,,,,,,,,,,,,,3.0,Baja California Sur,,1.0,1.0,Recursos fiscales,"Asuntos Econ¢micos, Comerciales y Laborales en General",,,,3.0,Desarrollo Econ¢mico,,,,,E,Prestaci¢n de Servicios P£blicos,," 1,431,735 ",3.0,Ejecuci¢nÿde los programas y acciones de la Pol¡tica Laboral,,0.0,Trabajo y Previsi¢n Social,Otros,14,2.0,Asuntos Laborales Generales,,1.0,Gasto corriente,,123,Delegaci¢n Federal del Trabajo en Baja California Sur,,,,,,,,
,,16.0,,,,2014.0,,,,Desarrollo Social,Recursos fiscales,Educación,,Remuneraciones adicionales y especiales,Fortalecimiento a la educación y la cultura indígena,Educación Pública,Otros Servicios Educativos y Actividades Inherentes,Gasto corriente,Instituto Nacional de Lenguas Indígenas,Complemento a los servicios educativos,,"Planeación, seguimiento y evaluación de políticas públicas",,,,,,,,,,2.0,1.0,5.0,,,,,P,"181,641.00",,,1300.0,,,,3.0,,,,11,,,6.0,,,1.0,,,MDB,,,,,,,
,,3.0,,,,2015.0,0,,Distrito Federal,Desarrollo Económico,Recursos fiscales,Combustibles y Energía,,Seguridad social,"Regulación y supervisión del otorgamiento de permisos y la administración de estos, en materia de electricidad, gas natural y gas licuado de petróleo",Comisión Reguladora de Energía,Petróleo y Gas Natural (Hidrocarburos),Gasto corriente,Unidad de Asuntos Jurídicos,Regulación eficiente del sector energético,,Regulación y supervisión,,,,,9.0,,,,,3.0,1.0,3.0,,,,,G,"$37,908.00",,,1400.0,,,,1.0,,,,45,,,2.0,,,1.0,,,212,,,,,,,
,,7.0,,,,2015.0,0,,Baja California,Desarrollo Social,Recursos fiscales,Protección Ambiental,,Servicios de arrendamiento,Programa de Inspección y Vigilancia en Materia de Medio Ambiente y Recursos Naturales,Medio Ambiente y Recursos Naturales,Otros de Protección Ambiental,Gasto corriente,Procuraduría Federal de Protección al Ambiente,Conservación y Manejo Sustentable de los Ecosistemas y su Biodiversidad,,Regulación y supervisión,,,,,2.0,,,,,2.0,1.0,1.0,,,,,G,"$10,000.00",,,3200.0,,,,5.0,,,,16,,,6.0,,,1.0,,,E00,,,,,,,
,,13.0,,,,2015.0,0,,Distrito Federal,Gobierno,Recursos fiscales,Coordinación de la Política de Gobierno,,"Servicios de instalación, reparación, mantenimiento y conservación",Registro e Identificación de Población,Gobernación,Población,Gasto corriente,"Subsecretaría de Población, Migración y Asuntos Religiosos",Sistema de Identificación Personal,,Prestación de Servicios Públicos,,,,,9.0,,,,,1.0,1.0,3.0,,,,,E,"$33,401.00",,,3500.0,,,,12.0,,,,4,,,7.0,,,1.0,,,400,,,,,,,
,,4.0,,,,2013.0,,,,Gobierno,Recursos fiscales,Relaciones Exteriores,,Servicios oficiales,"Promoción y defensa de los intereses de México en el exterior, en los ámbitos bilateral y regional",Relaciones Exteriores,Relaciones Exteriores,Gasto corriente,Dirección General para Africa y Medio Oriente,Vínculos políticos con el exterior que benefician los intereses nacionales,,"Planeación, seguimiento y evaluación de políticas públicas",,,,,,,,,,1.0,1.0,4.0,,,,,P,4908205.0,,,3800.0,,,,4.0,,,,5,,,1.0,,,1.0,,,413,,,,,,,
,,2.0,,,,2015.0,0,,Zacatecas,Gobierno,Recursos fiscales,Justicia,,Remuneraciones al personal de carácter permanente,Actividades de apoyo administrativo,Tribunales Agrarios,Impartición de Justicia,Gasto corriente,Oficialía Mayor,Servicios de apoyo administrativo,,Apoyo al proceso presupuestario y para mejorar la eficiencia institucional,,,,,32.0,,,,,1.0,1.0,2.0,,,,,M,"$244,921.00",,,1100.0,,,,1.0,,,,31,,,1.0,,,1.0,,,300,,,,,,,
